{
  "type": "01 51",
  "p0": {
    "model": "inferences/models/0151-whole-triangle-loop-on-the-ladder-entry.json",
    "model_sha256": "b921f5e12095a42f4e9fc606439145251285f7a5c2ed68aa28d02a242c7980db",
    "rendered_on": [
      ".cache/rendered/0151-whole-triangle-loop-on-the-ladder-entry/book-d2-1/01-51-40-03-08-held_organ",
      ".cache/rendered/0151-whole-triangle-loop-on-the-ladder-entry/book-d2-5/01-51-40-03-03-held_organ-p2"
    ]
  },
  "p1": {
    "verdict": "stopped",
    "gates": {
      "measured_in": "ms",
      "gross": {
        "passed": false,
        "residual_over_span": 0.383,
        "span": 0.013,
        "ceiling": 0.2,
        "why": "The median residual over the span the effect commands, taken as the worst of the records scored. A rejection bound and not a target: below it the residual is reported and never optimised, because no candidate is decided by it."
      },
      "qualitative": {
        "passed": false,
        "checked": [
          {
            "record": "efx-excursion:off_the_phase_ms [--carrier-hz 440]",
            "property": "direction",
            "value": [
              "book-d2-1/01-51-40-03-08-held_organ",
              21,
              74
            ],
            "unit": "rises",
            "model": "rises",
            "same": true
          },
          {
            "record": "efx-excursion:excursion_ms [--carrier-hz 440]",
            "property": "the unit's null control shows nothing, and so must the model",
            "unit": "nothing above a floor of 0 ms",
            "model": "4.227 ms",
            "same": false
          }
        ],
        "why": "Properties the unit's readings have that the model's readings must have too. No arithmetic over a residual rescues a model that cuts where the unit boosts."
      },
      "power": {
        "passed": false,
        "ranking": [
          {
            "candidate": "0151-whole-triangle-loop-on-the-ladder-entry",
            "model": "inferences/models/0151-whole-triangle-loop-on-the-ladder-entry.json",
            "mean_share_of_span": 0.3828,
            "worst_share_of_span": 0.3828,
            "leaning_records": 1,
            "contradicts_a_property": false
          },
          {
            "candidate": "0151-whole-triangle-loop-a-sample-late",
            "model": "inferences/models/0151-whole-triangle-loop-a-sample-late.json",
            "mean_share_of_span": 2.6797,
            "worst_share_of_span": 2.6797,
            "leaning_records": 1,
            "contradicts_a_property": false
          },
          {
            "candidate": "0151-whole-raised-sine-loop-a-sample-late",
            "model": "inferences/models/0151-whole-raised-sine-loop-a-sample-late.json",
            "mean_share_of_span": 2.9062,
            "worst_share_of_span": 2.9062,
            "leaning_records": 1,
            "contradicts_a_property": true
          },
          {
            "candidate": "0151-whole-raised-sine-loop-on-the-ladder-entry",
            "model": "inferences/models/0151-whole-raised-sine-loop-on-the-ladder-entry.json",
            "mean_share_of_span": 4.1953,
            "worst_share_of_span": 4.1953,
            "leaning_records": 1,
            "contradicts_a_property": false
          }
        ],
        "decoy": "0151-whole-triangle-loop-a-sample-late",
        "beaten_by": null,
        "separation": 2.297,
        "why": "The runner-up in the catalogue, scored on the same records, and whether it leans or contradicts a property where the winner does neither. The decoy is not chosen -- it is whichever candidate came second, so a strawman cannot be put up in its place. A class holding one candidate is a catalogue that is unfinished, which is a finding and not a pass."
      },
      "breakdown": {
        "passed": false,
        "breaks_down_at": [
          {
            "record": "efx-excursion:off_the_phase_ms [--carrier-hz 440]",
            "at": [
              "book-d2-1/01-51-40-03-08-held_organ",
              74
            ],
            "residual": 0.12250000000000001,
            "share_of_span": 9.57
          }
        ],
        "leaning_records": [
          "efx-excursion:off_the_phase_ms [--carrier-hz 440]"
        ],
        "records_the_run_did_not_reach": null,
        "why": "A point worse than 0.5 of the span is a failure at that point rather than error at it. A residual that leans with the setting or with frequency is pointing at a structure the model does not have; one that does not is pointing at the room and the converters, and is not made smaller by anything this project can do."
      }
    },
    "control": {
      "model": "identity",
      "separated": true,
      "gates": {
        "measured_in": "ms",
        "gross": {
          "passed": true,
          "residual_over_span": 0.195,
          "span": 0.013,
          "ceiling": 0.2,
          "why": "The median residual over the span the effect commands, taken as the worst of the records scored. A rejection bound and not a target: below it the residual is reported and never optimised, because no candidate is decided by it."
        },
        "qualitative": {
          "passed": false,
          "checked": [
            {
              "record": "efx-excursion:off_the_phase_ms [--carrier-hz 440]",
              "property": "direction",
              "value": [
                "book-d2-1/01-51-40-03-08-held_organ",
                21,
                74
              ],
              "unit": "rises",
              "model": "falls",
              "same": false
            },
            {
              "record": "efx-excursion:excursion_ms [--carrier-hz 440]",
              "property": "the unit's null control shows nothing, and so must the model",
              "unit": "nothing above a floor of 0 ms",
              "model": "0 ms",
              "same": true
            }
          ],
          "why": "Properties the unit's readings have that the model's readings must have too. No arithmetic over a residual rescues a model that cuts where the unit boosts."
        },
        "power": {
          "passed": false,
          "ranking": [],
          "decoy": null,
          "beaten_by": null,
          "separation": null,
          "why": "The runner-up in the catalogue, scored on the same records, and whether it leans or contradicts a property where the winner does neither. The decoy is not chosen -- it is whichever candidate came second, so a strawman cannot be put up in its place. A class holding one candidate is a catalogue that is unfinished, which is a finding and not a pass."
        },
        "breakdown": {
          "passed": false,
          "breaks_down_at": [
            {
              "record": "efx-excursion:off_the_phase_ms [--carrier-hz 440]",
              "at": [
                "book-d2-1/01-51-40-03-08-held_organ",
                74
              ],
              "residual": 0.0138,
              "share_of_span": 1.078
            }
          ],
          "leaning_records": [
            "efx-excursion:off_the_phase_ms [--carrier-hz 440]"
          ],
          "records_the_run_did_not_reach": null,
          "why": "A point worse than 0.5 of the span is a failure at that point rather than error at it. A residual that leans with the setting or with frequency is pointing at a structure the model does not have; one that does not is pointing at the room and the converters, and is not made smaller by anything this project can do."
        }
      }
    },
    "compared": [
      {
        "dir": "book-d2-1/01-51-40-03-08-held_organ",
        "setting": 21,
        "input_from": "book-d2-1/01-51-40-03-08-held_organ",
        "channel": 2
      },
      {
        "dir": "book-d2-1/01-51-40-03-08-held_organ",
        "setting": 74,
        "input_from": "book-d2-1/01-51-40-03-08-held_organ",
        "channel": 2
      },
      {
        "dir": "book-d2-5/01-51-40-03-03-held_organ-p2",
        "setting": 90,
        "input_from": "book-d2-5/01-51-40-03-03-held_organ-p2",
        "channel": 2
      }
    ],
    "held_out_settings": [
      [
        "book-d2-1/01-51-40-03-08-held_organ",
        21
      ],
      [
        "book-d2-1/01-51-40-03-08-held_organ",
        74
      ],
      [
        "book-d2-5/01-51-40-03-03-held_organ-p2",
        90
      ]
    ],
    "excluded_from_ranking": [],
    "comparison": {
      "used": "readings",
      "chosen_by": "by_repeatability_class",
      "cut_hz": 12000
    },
    "classes": [
      {
        "class": "held_organ",
        "used": "readings",
        "chosen_by": "by_repeatability_class",
        "floor_db": null,
        "settings": 3,
        "standing": 3,
        "dirs": [
          "book-d2-1/01-51-40-03-08-held_organ",
          "book-d2-5/01-51-40-03-03-held_organ-p2"
        ]
      }
    ]
  },
  "stopped": {
    "at": 8,
    "gate": "gross",
    "needs": "gross on efx-excursion:off_the_phase_ms, undecided at book-d2-1/01-51-40-03-08-held_organ at 21, 74. Needs a candidate for 01 51 that clears the gross gate, or a measurement that separates the ones standing."
  },
  "equivalent_under_this_test": [],
  "invocation": {
    "unit": "roland-sc8850-01",
    "type": "01 51",
    "class": "whole-0151"
  },
  "rendered_with": {
    "numpy": "2.4.6",
    "scipy": "1.17.1"
  }
}
